dimension,factor,item,categorias
Percepción,Meritocrática,En Chile las personas son recompensadas por sus esfuerzos,Likert “muy en desacuerdo” (1) hasta “muy de acuerdo” (4).
Percepción,Meritocrática,En Chile las personas son recompensadas por su inteligencia y habilidad,Likert “muy en desacuerdo” (1) hasta “muy de acuerdo” (4).
Percepción,No meritocrática,En Chile a quienes tienen padres ricos les va mucho mejor en la vida,Likert “muy en desacuerdo” (1) hasta “muy de acuerdo” (4).
Percepción,No meritocrática,En Chile quienes tienen buenos contactos les va mejor en la vida,Likert “muy en desacuerdo” (1) hasta “muy de acuerdo” (4).
Preferencia,Meritocrática,Quienes más se esfuerzan deberían obtener mayores recompensas que quienes se esfuerzan menos,Likert “muy en desacuerdo” (1) hasta “muy de acuerdo” (4).
Preferencia,Meritocrática,Quienes poseen más talento deberían obtener mayores recompensas que quienes poseen menos talento,Likert “muy en desacuerdo” (1) hasta “muy de acuerdo” (4).
Preferencia,No meritocrática,Está bien que quienes tienen padres ricos les vaya bien en la vida,Likert “muy en desacuerdo” (1) hasta “muy de acuerdo” (4).
Preferencia,No meritocrática,Está bien que quienes tienen buenos contactos les vaya bien en la vida,Likert “muy en desacuerdo” (1) hasta “muy de acuerdo” (4).